{
  "kind": "review",
  "layout": 2,
  "document": {
    "reviews": [
      {
        "number": 1,
        "reviewed_at": "2026-10-23",
        "commits": {
          "app": "840fa0c"
        },
        "findings": []
      }
    ]
  },
  "problems": [
    {
      "file": "build/review.md",
      "line": 20,
      "message": "finding F1 names repo ap, which review 1 does not list in its commits"
    }
  ]
}
